1,4,CoCo Butter - Retroj,"fyp, viral, itsoucyeli",itsoucyeli,730200
1,6,original sound - Amyah💕,"fyp, tiktok, familyflawsandall, tiktokchallenge, rewindablemoments, blowthisup, amyah_bennett, aj, viral, viraltiktok, fypage, trend, notamyahh%F0%9F%92%95",amyahh_bennett,91900
2,0,som original - Mariany Belsi,"marianybelsi, paravoce, foryou, viral, fy",mariany_belsi,583600
2,4,Gaichite - Misha Xramovi,"meme, fyp, foryou, funnyvideo, viralvideo, %F0%9F%A4%A3%F0%9F%A4%A3%F0%9F%A4%A3",funnyvideos.770,8318
2,8,Airplane mode prodbyabnornal - Jenesis ✦,"fyp, foryoupage, foryoupageofficiall, sanni, 80k, blowthisup%3F, foryou, 100k, views, zyxcba, beyourself, makemefamous",humbleupking,197600
2,16,son original - massymoussi,"@tammybradley6, anesthesia, hospital, nurse, rizz, foryou",wannaft_banana,395500
2,19,original sound - Alvardo,"fyp%E3%82%B7, foryou, movieclips, funny",alvardo.nb,159900
2,22,yall be eatin the plate up - memawneedsmoney,"@themiyanevaeh, tufcrj, kinigradeon, fyp, viral",rj_tufc,99300
2,25,8 o clock in the morning - 666lolkevin,"fyp%E3%82%B7%E3%82%9Aviral, fy, goviral, trending, relatable, viral, food",rubdagoat,1706
3,0,sonido original - NORBIT👑,"ddosama, foryou, fyp, norbit_edits",norbit_edits,9337
3,6,Funny - Gold-Tiger,"foryou, fyp",miusuu362,21000
3,11,original sound - Grandview HS Cheer,"fyp, foryou, miyanevaeh, wtofam",themiyanevaeh,18900
3,12,Dramatic Military - Faid rafanda,"scary, ghost, horror, mystery, fyp, viralvideo, paranormal, trending, viraltiktok, trend, viral, fpy",betausa89,2489
3,15,origineel geluid - Aqua,"4k, kingvon, edit, rapper, viral, rip, foryou",aquaaeditor,20200
3,21,original sound - spo6kzie,"fyp, viral, philly",jordan2chill,10900
3,22,original sound - nottiosamaaa1,"nottiosama, ethanreyes, e4n, forever14, rip, foryou, viral, nydrill, harlem",nottiosamaaa1,9044
4,14,alkuperäinen ääni - Jamppazu,"whoheem, whoheemletslink, letslink, whoheemedit, whoheemeditz, whoheemofficial, whoheemsongs, whoheemlyrics, 2020trend, lyrics, edit, music, blowthisup, viral, bangersquad, bangermusik, jamppazu, jamppazuedits, 2020bangers, trendingin2020, whoremembersthisone%E2%98%9D%EF%B8%8F, letslinkedit",jamppazu,130100
4,15,original sound - Ozzy GmodTV,"garrysmod, nextbot, chase, horror, gmod_videos, meme, poolrooms, terrifying, chase, ozzygmod, ozzygmodtv, foryou, viral, fyp, xyzbca",ozzygmodtv,1517
4,16,original sound - 𝐒𝐀𝐑𝐀𝐇,"fyp, viral, xybca, blowup%3F, @jusschris_",.thisisnotzay2.0backup,69900
4,18,Originalton - Memes4Life,"viral, meme, foryou, fyp%E3%82%B7%E3%82%9Aviral, fyp%E3%82%B7, daily, dog, snacks",memegodgermany,688300
4,23,suono originale - Drippy14🇧🇷,"usa, usadrip, usastyle, drip, drill, viral, makethisgoviral, 500kvisual, makemefamous",_drippy_14,6653
4,28,original sound - Homa-★Fanpage★,"homm9k, homa, homaxxfan, foryoupage, foryou, fyp, somineral",homaxx.fan,2840
5,4,original sound - The Reddit Cook,"reddit, redditstories, redditstory, redditreadings, redditstorytime, reddit_tiktok, fyp, viral, foryoupage, stories, usa",the_reddit_cook,419000
5,9,original sound - Karen,"foryou, fyp",user416881636533,2982
5,18,son original - NODDI,"e4n, e4notti%F0%9F%95%8A, oy, nyc, notti, nottiosama, ddosama, sugarhillddot, brother, edit, forever14, nottiworld%F0%9F%8C%8D, ripnottiosama, quality, explore, viral, fyp, rap, song, music, forever14, fyp%E3%82%B7",noddi_edits,27100
5,21,original sound - B I A N C A,"pokerface, challange, ladygaga, new, dance, duet, douyin, %F0%9F%A4%8D, %F0%9F%96%A4, trening, following, viral, fyp, fouyou, parati",yanhui1819,21000
5,24,original sound - SpotifySongs,"foryoupage, fyp, xyzbca, viral, trending, fyp",absolutehumanbeing,78700
