batch,index,music,hashtag,author,likes,comments,shares,saves
1,0,Storytelling - Adriel,"fyp, fortnite, gaming, trendiing, fortnitezerobuild, fortnitebr, fortnitememes, fortnitepro, camnutz",camnutz_,30500,447,2182,33
1,1,original sound - divin,,ellielobio,225600,427,20000,602
1,2,Meow - Dust☆,"@cofflefish, voiceover, voiceovers, elsa, elsafrozen, anna, annafrozen, frozen, frozenmovie, frozenmoment, frozenmoments, frozenelsa, frozenanna, elsaandanna, annaandelisa, frozenelsaandanna, arendelle, disney, disneymovies, disneymovie, disnevplus, disneyanimation, disneyplus, disneyfrozen, princessanna, queenelsa, princehans, hans, princehansofthesouthernisles, hansofthesouthernisles",risottosimp3000_3.0,47200,1109,9839,1948
1,3,original sound - tsquadgotmyheart,"tsquadeditss, tommytheclownn, tsquadeditor, tristentommytheclown%E2%9A%A1%EF%B8%8F, bunnytommytheclown, tommytheclownedits%E2%9D%A4%EF%B8%8F%F0%9F%96%A4",tsquadgotmyheartfr,21600,121,5435,112
1,4,La Señora De Acero - Los Tucanes De Tijuana,viejascabrona,r_edith89,67000,882,3928,1696
1,5,original sound - Drill🐺,"ddosama, ddosama, sugarhillddot, ddotedit, ddosamaedits, fyp, fyp%E3%82%B7, 4u, foryou, foryoupage, nyc, newyork, nydrill, nydrillrap, nycdrill",bronxdrillsss,265500,368,25000,1533
1,6,original sound - sketchlyricz,"nalish, nalish, nidalwonder, salishmatter, nalishedits, nalishforever",nalish.editsx1,75400,884,7187,378
1,7,original sound - Nieka Richard,"@wockhardt03, principalrichard",niekarichard,8500000,107900,687800,129800
1,8,Love You So - The King Khan & BBQ Show,"viral, valentinesday, fyp, boyfriend",andrea.lopez44,178100,560,13600,3959
2,0,original sound - alexa_de,"miniphone, miniiphone, bezosmax, minismartphone, cute, tiktokshop, pinkphone",alexa_de,4400000,24200,619100,158700
2,1,original sound - spo6kzie,"fypage, viral",phillygoatdyceeeee,148800,584,16900,473
2,2,sonido original - halo,"@lilwavy.7, @yohan_lbt, diamantblazi, seckoff, basketball, bball, mediaday, fyp, viral, florida, usa",diamantblazi,507800,2188,38400,2269
2,3,original sound - _lortinkyy,@msb_rayshawn,_lortinkyy,1700000,16600,114700,68800
2,4,original sound - Noooooodle,"@realjordanmatter, nidalwonder, salishmatter, nalish, jordanmatter, nidalwonderedits, nidalwondereditstt, nidalrizz, love, rizz, rizzler, rizzgod",nidalwonderedits,11900,197,2169,443
2,5,sonido original - Team Saoco 🕺💃,"teamsaoco%F0%9F%92%83%F0%9F%95%BA, elbaby%F0%9F%95%BA, videoviral, fyppppppppppppppppppppppp, fyp, viralvideo, teamsaoco%F0%9F%92%83%F0%9F%95%BA",amor_a_el_teamsaoco,7929,206,465,19
2,6,original sound - I follow back 🙈,"biggynorriss, norrisnuts, capcut, glowup, edit, biggynorrisedit",where.you.are03,93100,2270,17000,2448
2,7,original sound - Geu,"foryou, film",geu1391,278600,572,24800,229
2,8,origineel geluid - nalish.fanpage,"capcut, nalishforever, nidalwonder, salishmatter, shipnalish, bestfriends",nali.sh_fanpage,2034,34,360,14
2,9,original sound - L.Neal,"teach, teacher, teacherskid, imateacherskid, teachers, teachersoftiktok, teacherlife, teachersbelike, teachertiktok, teachersontiktok, teacherproblems, teacherhumor, kid, kidsoftiktok, trend, tiktoktrend, valentine, valentinesday, vday, february",l.neal,71700,1240,8719,192
2,10,"Down, Up! - BabyTron",kaneandprymr,kaneandprymrr,71200,147,4257,123
2,11,original sound - Camilla Araujo,"interview, publicinterview, minivlog, fyp",camillaara.backup,35100,182,6748,214
2,12,BOBBLEHEAD (She's A BobbleHead) [remastered] - FiyaBoi,"bobblehead, buzzin",erica.smith007,65,4,8,1
2,13,Faneto by Chief Keef - 𝕮𝖗𝖎𝖘𝖙𝖎,,_evapaap_,358100,1907,51300,7980
2,14,Rob 49 x 2Rare x Skilla baby - 2RARE🇬🇭🇳🇬,@a.s.k_kj,rkempiiree,88700,1153,9132,302
2,15,son original - Tsqua_d,"soraya, raya, tsquad, tsg, thg, edit, tommy, tommytheclownn",tsqua_d8,2574,3,191,6
2,16,son original - ♥️cute♥️,"pourtoi, failfyp%E3%82%B7%E3%82%9Aviral, funnybabyvideos, rire, compilation",so.cute.funny,1600000,10400,206400,75300
2,17,original sound - l_ma1,"fyp, foryoupage, dubai%F0%9F%87%A6%F0%9F%87%AA",lucyhightonx,55200,153,4084,365
2,18,nhạc nền - Kiara,"salishmatter, hudsonmatter, saysaymatte, saymatte, fatherdaughter, date, daughter, mydaughter, viral, trending, fyp, saysaymattter",kiara_fanus,282900,1095,23000,609
2,19,soak city (do it) - 310babii,,jadan.s.m_zay,2200000,3348,112400,1733
2,20,original sound - KungFuRob,"kungfu, ropedart, lethkmcook, martialarts, okc",kungfurob,68300,457,4508,267
2,21,original sound - tsquadgotmyheart,"kimoralatte, tsquad, getmefamous, capcut",official_tsquad2,24600,151,4893,168
2,22,original sound - ྀི,"fyp, seraphsworld, bts, film",_seraphsworld_,456200,3066,44600,1080
2,23,original sound - Raihann,,sylviaquezada619,5800000,33600,598900,114100
2,24,Monkeys Spinning Monkeys - Kevin MacLeod & Kevin The Monkey,"teachersoftiktok, teachersdressedasstudents, teacherfun, blackteachersontiktok",brittan.ya,3600000,38700,268700,101600
3,0,الصوت الأصلي - AYMAN - ايمن,"%F0%9F%A7%95, allah%E2%9D%A4%EF%B8%8F, islamic_video, %E1%8A%A0%E1%88%8D%E1%88%80%E1%88%9D%E1%8B%B1%E1%88%8A%E1%88%8B%E1%88%85_%E1%88%99%E1%88%B5%E1%88%8A%E1%88%9D_%E1%88%8B%E1%8B%B0%E1%88%A8%E1%8A%A8%E1%8A%9D_%E1%8C%8C%E1%89%B3, ethiopian_tik_tok, oromotiktok%E2%9D%A4%EF%B8%8F%F0%9F%92%9A%E2%9D%A4%EF%B8%8F",yasimine430,1766,169,2905,611
3,1,Creepy horror ambient(1022762) - howlingindicator,"disturbing, 911calls, crime, truecrime, 911, crimejunkies, foryou, cops, storytime, foryoupage, fu, reddit, fyp%E3%82%B7, mattponomarenko",crimewave_911,796100,9457,71900,9393
3,2,Back Lit - Rod Wave,,slimelifejay7,25300,88,2031,81
3,3,nhạc nền - us.cominghome.99,"cominghome, surprise, soldiercominghome, military, viralvideo, fyp",us.cominghome.99,10700,234,6852,67
3,4,original sound - Miss_Snowwolf_jku,,miss_snowwolf_jku,277600,675,26700,774
3,5,original sound - KC,"northwest, kimkardashian, kardashians, fyp",kardahiansclips,1600000,6770,69100,11700
3,6,Brutus (Instrumental) - The Buttress,"horror, scary, creepy, spooky, haunted",horror.story.x,87600,6919,27500,2263
3,7,son original - Tsqua_d,"trin, jayah, edit, tommy, tommytheclownn, tsquad, trinvsjayah, battle, mora",tsqua_d8,5638,17,637,37
3,8,original sound - kaneljoseph,"kanelmeme, kaneljosephclips, movietheaterhacks, youtubeprank",kanelmeme,389000,743,61100,1319
3,9,son original - LYSEDIT™,"vsp, lysedit, fyp, missk",.lysedit,536700,3811,92400,3334
3,10,original sound - lukekirchhoff,"patience, challenge, magic, foryou, fyp",lukekirchhoff,487600,29700,55900,11300
3,11,Thats my girl - Shiloh and bros,"@shilohandbros, joshlyn, cute, joshia, shiloh, elijah, capcut, shilohandbros, viral, dontmutemysound, fypviral, sabfan, sab, dontletthisflop, fyp, bros",shilohandbros_x,30100,291,6091,371
3,12,original sound - Mary Cooper,"youngsheldon, youngsheldontok, georgiecooper, missycooper, raeganrevord, montanajordan",marycooperfan3,11900,80,1441,41
3,13,original sound - ℒ𝒾𝓁𝓎⸆⸉,"@plmakeupacademy, @glowrecipe, @bubble, @lorealparis, @makeupbymarioo, @tarte.beauty, @bossupcosmetics, plouise, plouisemikayla, makeup, grwm_aesthetics, grwmroutine, grwmroutine, grwmmakeup",grwmwithlily8,47800,2626,4170,728
3,14,sonido original - Alexis__☠️,"@peppa_compay1, escuela, promo, lentejas, fyp, parati, baile",alexis__ldc,124400,957,8039,362
3,15,original sound - my 🧚🏽‍♂️,"foryoupage, hair, edgeband, wakeup, wigs, fyp, jamaicanprincess%F0%9F%87%AF%F0%9F%87%B2",jamaicanprincessa_,118200,651,8042,1065
3,16,Burnt Rice (feat. Yung GEMMY) - Shawn Wasabi & YDG,familyfun,udijsbd,185900,2098,26700,693
3,17,sonido original - halo,"diamantblazi, seckoff, basketballplayer, floridabasketball, florida, usa, usabasketball, dunk, explore, explorepage, foryou, fyp, pourtoi, viral, lifestyle, trend",diamantblazi,238100,1765,14500,2058
3,18,original sound - Alex Nino Truckers,"alexnino, truck, driver, vlog, us, usa, trucker, camping, trucks, capcut",alexninotruckers,3400000,16200,284000,15900
3,19,Wild thoughts - Spe3dupaudiosforyou,,jiah.khann,223900,948,18400,1201
3,20,original sound - Cool Grandpa👴🏼,"grandpa, joke, fypisbroken, comedy, jokes, relatable, fyp%E3%82%B7%E3%82%9Aviral, funny, school, nap",theverycoolgrandpa,4300000,35900,478200,65900
3,21,je te laisserai de mots - ☆☆,"schoolphotos, schoolpic, pictureday, firstdayofschool, lastdayofschool, prek, graduation, schoolpictureframe",graceandrosesco_,1800000,0,201700,30500
3,22,Low - Flo Rida,gladyouasked,paulinamisha,1800000,37300,123000,102200
4,0,original sound - Kervo.dolo,"fyp, foryoupage",kervo.dolo,6200000,42900,565100,125500
4,1,som original - Leozin.Beats,"grillz, leozinbeats, caradosgrillz",leozin.beats,233600,2951,23000,1480
4,2,You Can't Beat Me Challenge Jersey Club (Suunnnlight Vocals) - YKaY,"tjaysturn, tsquad, losangeles, fyp",tjaysturn,113600,601,19500,386
4,3,2Humpy is Back - tyyslatt,"fyp, highschool, viral",5staradriii3,1200000,5707,124400,1627
4,4,original sound - 🍂 H E A R T S T O P P E R 🍂,,.heartstopper23,84,0,18,4
4,5,original sound - Paul Vu,,paulvutv,149700,9308,23200,14100
4,6,son original - NODDI,"ddosama, e4n, nottiosama, nottiworld%F0%9F%8C%8D, longlivenotti, quality, foryou",noddi_edits,58500,709,9847,372
4,7,original sound - Isaacclips,,bespamin,1200000,5989,118500,10800
4,8,original sound - SwagBoyQ on IG,"publicinterview, swagboyq, gift, fyp",swagboyq,52400,202,3067,40
4,9,original sound - f u n n y moments,"fyp, couple, couplecomedy",funnyviralvms,295100,6352,33700,3361
4,10,original sound - AGGAYUCITA<3,,aggayucita,2200000,16900,249100,42800
4,11,original sound - Horror Story X👀,"horror, scary, creepy, spooky, haunted",horror.story.x,175400,13900,32500,17300
4,12,original sound - jovynn,"fyp, miami, artbaselmiami, artbasel, miamiproblems, hialeah, 305",imstephm_,1100000,12500,54700,25200
4,13,original sound - Logan Miller,,loganmillerx,200600,622,11900,213
4,14,Yeah! (feat. Lil Jon & Ludacris) - Usher,"anniversary, confessions",usher,436800,2880,23700,6862
4,15,sonido original - Bad Gyal Alba Pussy K Mana,"@popactuality, kabab, badgyal, parati, humor",diegoovilass_,83200,356,5792,3273
4,16,original sound - NFL💔LEE,"jaleel, jaleelsisterjada, jaleelbrotherjeremiah, jaleelbrotherjayden, fyp, fyp%E3%82%B7, foryourpage, foryoupage, foryou",nofakelove_lee,116200,3170,10800,2112
4,17,original sound - lowkey.nuts34,,lowkey.nuts34,1100000,27900,225200,166100
4,18,original sound - Shida Rae 🌈😘,competitionday,toogay2care,84400,282,9676,206
4,19,original sound - Owen Lynch,,hahowen,252700,517,16600,181
4,20,YKWIM? - 东 百 下小 雨,"viral, sad, love, pain, real",silkyslive,362300,6499,50200,2466
4,21,original sound - بدون دقات,"toy, galaxyball, moonball",fenixballus,4721,243,702,70
4,22,supïdo Jiafei Remix - FlopcakKe,"jiafei, jiafeiproducts, lifehack, vtvcab, meme",kietfei,3200000,33100,197900,53400
4,23,Makeba - Jain,,vlarino,247900,5813,27300,4994
4,24,Aesthetic - Tollan Kim,"fyp, tiktok, tvshow",zeyadeh.hetsler,779100,1359,63500,802
5,0,original sound - c<3 - Jnx_,"ghost, ghostcosplay, ghostcod, callofduty, cod, fyp",matsglans,556000,5158,105200,6806
5,1,Better Than Me [Explicit] - Q Money,,weloveody,312700,963,24200,390
5,2,idyll - jonjthan,"mvb, trendy, az, vert, jump, bunnies, spike, volleyballplayer, mensvolleyball, voley, fyp%E3%82%B7, trending, @ginger_fellow, capcut",ayofiako,1600000,3002,65600,2294
5,3,original sound - haileena,"fyp, viral",prettyyluhthug,72800,260,9555,531
5,4,original sound - Gameconsole888,"fyp, viral",chuchiiivibin,142400,271,12800,178
5,5,original sound - Didios,"random, facts, girls",didiios,42800,1630,3984,12100
5,6,original sound - alexbreakshisback,"school, funny, bestfriend, viralvideo, blowthisup, fyp, foryou, foryoupage, fyp%E3%82%B7, fyp%E3%82%B7%E3%82%9Aviral",liam_donley,1500000,38900,119100,25500
5,7,original sound - stephanie,"substitute, substituteteacher, fyp, fyp%E3%82%B7, college",steph.pantaleon,1500000,1516,60200,480
5,8,original sound - nicoleskirts,,knicolepeach,39000,432,4149,1255
5,9,Im Da Man - Lil Tony Official & Lil RT,"lilrt, ddosama, bts, fyp",kharkee,61900,274,5820,241
5,10,Suara Seram Sangat Mencekam - Kholil Buitenzorg,"factsyoudidntknow, facts, satisfying, satisfyingvideo, learnontiktok, learn, satisfyingvideos",real.insane.videos,10300,6874,2278,27600
5,11,original sound - Ciara_makeup,,jasminechiswell,427900,1136,24500,2684
5,12,original sound - sav,"howmuchimade, coutingtips, hooters, hootersgirl, birthday, foryou, fyp%E3%82%B7",savwayy,872900,1813,36800,2441
5,13,original sound - MILITARY EDIT 3,"funnymoments, navy",military_lp,40600,206,5143,123
5,14,original sound - The Rideshare Hub,,ridesharehub,42600,494,4605,287
5,15,soak city (do it) - 310babii,,jadan.s.m_zay,226500,282,14700,1072
5,16,Move Yo Body fazo edit - fazo💫,,uluv.luna.tuna,94000,164,7487,119
5,17,Vibe (If I Back It Up) - Cookiee Kawaii,"fyp, nj",breeiania,59300,131,3394,148
5,18,yaal are so finee - ¥,,bby..juana,224900,777,15800,650
5,19,original sound - ✨DLA Fam✨,"family, 6foot10, 5foot2",dla_fam,2800000,29000,153600,16600
5,20,original sound - ashley rose,,ashleyroseclips,15000,82,1485,6
5,21,original sound - spo6kzie,"@.jaylaaaaa_, rizz, viral, fyp, foryoupage, foryou",luvabxbyy.a,1500000,3359,129699,5279
5,22,Diamondz n Roses - VaporGod,"fyp%E3%82%B7, relatable, fyp%E3%82%B7viral, viral",dymestaypaid,111400,489,12200,369
5,23,original sound - steph,,stephanieyo,2800000,17300,292200,36300
5,24,original sound - Salish & Nidal,"salishmatter, jordanmatter, nidalwonder, fyp, viral",salishnidalcute,45200,99,3579,122
5,25,original sound - Chris and jasmin,"surprise, drama, fyp, viral, trending",chrisandjasmin,13700,329,1751,207
5,26,original sound - haleyybaylee,@courteneycoxofficial,haleyybaylee,4500000,9138,182900,10300
5,27,original sound - snowy_pipes,"piperrockelle, piper, viral, viralvideo, fyp",the_squad_bby_piper,458000,1518,39300,708
